{"$schema":"https://json-schema.org/draft-07/schema#","description":"Common envelope for the DASH-0a dashboard consolidation fixtures. `kind` pins the algorithm to dashboard-tab-plan. `expected` encodes the totality guarantee (every current TabId folded onto exactly one surface), the no-collision/no-dropped-source guarantee, and the flag-off inertness guarantee (plan module never imported, shell byte-identical).","properties":{"assertion":{"type":"string"},"expected":{"properties":{"collision":{"type":"boolean"},"dropped_sources":{"items":{"type":"string"},"type":"array"},"each_mapped_once":{"type":"boolean"},"flag_enabled":{"type":"boolean"},"routing_changed":{"type":"boolean"},"shell_touched":{"type":"boolean"},"source_tab_ids":{"type":"integer"},"surfaces":{"type":"integer"}},"type":"object"},"id":{"type":"string"},"kind":{"enum":["dashboard-tab-plan"],"type":"string"},"producer":{"type":"string"},"schema":{"type":"string"}},"required":["id","producer","assertion","kind","schema","expected"],"title":"DASH-0a dashboard consolidation tab-plan fixture envelope","type":"object"}
